{
  "$schema": "https://json-schema.org/draft/2020-12/schema",
  "$id": "skill-rails/source-package/2",
  "type": "object",
  "additionalProperties": false,
  "required": ["schemaVersion", "packageId", "packageVersion", "modules", "targets"],
  "properties": {
    "schemaVersion": {"const": 2},
    "packageId": {"type": "string", "pattern": "^[a-z0-9]+(?:-[a-z0-9]+)*$"},
    "packageVersion": {"type": "string", "minLength": 1},
    "modules": {
      "type": "object",
      "propertyNames": {"pattern": "^[A-Za-z][A-Za-z0-9_-]*$"},
      "additionalProperties": {"type": "string", "minLength": 1}
    },
    "tools": {
      "type": "object",
      "propertyNames": {"pattern": "^[a-z0-9]+(?:-[a-z0-9]+)*$"},
      "additionalProperties": {"type": "string", "minLength": 1}
    },
    "targets": {
      "type": "object",
      "minProperties": 1,
      "propertyNames": {"pattern": "^[A-Za-z][A-Za-z0-9_-]*$"},
      "additionalProperties": {"type": "string", "minLength": 1}
    }
  }
}
