{
  "schemaVersion": 2,
  "packageId": "natural-language-pilot",
  "packageVersion": "0.0.1",
  "modules": {
    "purpose": "modules/purpose.md"
  },
  "targets": {
    "direct-next": "targets/direct/target.json",
    "product-next": "targets/product/target.json",
    "resume-next": "targets/resume/target.json",
    "work-next": "targets/work/target.json",
    "verify-next": "targets/verify/target.json"
  }
}
